<?xml version="1.0" encoding="UTF-8" ?>
<typesConfig
        xmlns="https://www.draagon.com/types/v2"
        xmlns:xsi="http://www.w3.org/2001/XMLSchema-instance"
        xsi:schemaLocation="https://www.draagon.com/types/v2 ../types/types-config.xsd">

    <types>

        <type name="metadata" class="com.draagon.meta.MetaData" >
            <children>
                <child type="object" subType="*" name="*"/>
                <child type="field" subType="*" name="*"/>
                <child type="validator" subType="*" name="*"/>
            </children>
        </type>

        <type name="attr" class="com.draagon.meta.attr.MetaAttribute" defaultSubType="string">
            <subType name="string"       class="com.draagon.meta.attr.StringAttribute" />
            <subType name="stringArray"  class="com.draagon.meta.attr.StringArrayAttribute" />
            <subType name="properties"   class="com.draagon.meta.attr.PropertiesAttribute" />
            <subType name="class"        class="com.draagon.meta.attr.ClassAttribute" />
            <subType name="boolean"      class="com.draagon.meta.attr.BooleanAttribute" />
            <subType name="int"          class="com.draagon.meta.attr.IntAttribute" />
        </type>

        <type name="object" class="com.draagon.meta.object.MetaObject" defaultSubType="map">
            <children>
                <child type="attr" subType="boolean" name="_isAbstract"/>
                <child type="attr" subType="boolean" name="isInterface"/>
                <child type="attr" subType="boolean" name="isKey"/>
                <child type="field" subType="*" name="*"/>
            </children>
            <subType name="pojo" class="com.draagon.meta.object.pojo.PojoMetaObject">
                <children>
                    <child type="attr" subType="string" name="object"/>
                </children>
            </subType>
            <subType name="map" class="com.draagon.meta.object.mapped.MappedMetaObject">
                <children>
                    <child type="attr" subType="string" name="object"/>
                </children>
            </subType>
            <subType name="proxy" class="com.draagon.meta.object.proxy.ProxyMetaObject">
                <children>
                    <child type="attr" subType="string" name="object"/>
                    <child type="attr" subType="String" name="proxyObject"/>
                </children>
            </subType>
        </type>

        <type name="field" class="com.draagon.meta.field.MetaField" defaultSubType="string">
            <children>
                <child type="attr" subType="boolean" name="_isAbstract"/> <!-- inlineAttr="required" / -->
                <child type="validator" subType="*" name="*"/>
            </children>
            <subType name="boolean"      class="com.draagon.meta.field.BooleanField" />
            <subType name="byte"         class="com.draagon.meta.field.ByteField" />
            <subType name="short"        class="com.draagon.meta.field.ShortField" />
            <subType name="int"          class="com.draagon.meta.field.IntegerField" />
            <subType name="long"         class="com.draagon.meta.field.LongField" />
            <subType name="float"        class="com.draagon.meta.field.FloatField" />
            <subType name="double"       class="com.draagon.meta.field.DoubleField" />
            <subType name="string"       class="com.draagon.meta.field.StringField" />
            <subType name="date"         class="com.draagon.meta.field.DateField" />
            <subType name="class"        class="com.draagon.meta.field.ClassField" />
            <!-- subType name="booleanArray" class="com.draagon.meta.field.BooleanArrayField" />
            <subType name="byteArray"    class="com.draagon.meta.field.ByteArrayField" />
            <subType name="intArray"     class="com.draagon.meta.field.IntegerArrayField" />
            <subType name="longArray"    class="com.draagon.meta.field.LongArrayField" />
            <subType name="floatArray"   class="com.draagon.meta.field.FloatArrayField" />
            <subType name="doubleArray"  class="com.draagon.meta.field.DoubleArrayField" / -->
            <subType name="stringArray"  class="com.draagon.meta.field.StringArrayField"/>
            <!-- subType name="dateArray"    class="com.draagon.meta.field.DateArrayField" /-->
            <subType name="object"       class="com.draagon.meta.field.ObjectField">
                <children>
                    <child type="attr" subType="string" name="objectRef"/>
                </children>
            </subType>
            <subType name="objectArray"  class="com.draagon.meta.field.ObjectArrayField" >
                <children>
                    <child type="attr" subType="string" name="objectRef"/>
                </children>
            </subType>
        </type>

        <type name="validator"  class="com.draagon.meta.validator.MetaValidator" defaultSubType="required" defaultNamePrefix="validator">
            <subType name="required" class="com.draagon.meta.validator.RequiredValidator"/>
            <subType name="regex" class="com.draagon.meta.validator.RegexValidator">
                <children>
                    <child type="attr" subType="regex" name="mask"/> <!-- inlineAttr="optional" required="true"/ -->
                </children>
            </subType>
            <subType name="numeric" class="com.draagon.meta.validator.NumericValidator" />
            <subType name="length" class="com.draagon.meta.validator.LengthValidator" >
                <children>
                    <child type="attr" subType="int" name="min"/> <!-- inlineAttr="optional" autoCreate="true" defaultValue="0" minValue="0"/ -->
                    <child type="attr" subType="int" name="max"/> <!-- inlineAttr="optional" required="true" minValue="0"/-->
                </children>
            </subType>
        </type>
    </types>

</typesConfig>
